{
  "$schema": "../schema/interface-config.schema.json",
  "schemaVersion": 1,
  "standardVersion": "0.1.0-dev",
  "policy": {
    "mode": "advisory-plus-executable-validation",
    "aiFirst": true,
    "gui": false,
    "frameworkAgnostic": true,
    "visualIdentityAgnostic": true,
    "promoteOnlyStableRepeatedPatterns": true,
    "visualDecisionAuthority": "consumer-project-context",
    "providesDesignCapabilitiesNotDecisions": true,
    "visualCompositionRecipes": false
  },
  "architecture": {
    "activeModules": [
      "core",
      "validator",
      "resolver",
      "compiler",
      "public-api",
      "foundations-data",
      "modes",
      "accessibility-data"
    ],
    "plannedModules": [
      "contracts"
    ],
    "tokenLayers": [
      "primitive",
      "semantic",
      "contract"
    ],
    "consumerBoundary": "src/index.ts",
    "vendorBoundary": "src/compiler/",
    "foundationProfile": "config/pfx-foundations.v0.1.json",
    "modeProfile": "config/pfx-modes.v0.1.json",
    "accessibilityProfile": "config/pfx-accessibility.v0.1.json"
  },
  "tokens": {
    "standard": "DTCG-2025.10",
    "cssPrefix": "--pfx-",
    "allowedTopLevelCategories": [
      "color",
      "space",
      "size",
      "radius",
      "border",
      "font",
      "shadow",
      "motion",
      "z",
      "layout",
      "component"
    ]
  },
  "naming": {
    "canonicalSystem": "pfxamd/pfx-naming-system",
    "canonicalVersion": "3.1.0",
    "fingerprintLevel": "balanced"
  },
  "vendors": {
    "preferredTokenCompiler": "style-dictionary",
    "rule": "Vendor tooling must remain behind a PFx-owned compiler adapter boundary.",
    "preferredTokenCompilerVersion": "5.5.5",
    "strategy": "pfx-resolve-then-vendor-transform"
  },
  "conformance": {
    "target": "DTCG-2025.10",
    "status": "documented-subset",
    "supported": {
      "rootTokens": true,
      "curlyTokenAliases": true,
      "jsonPointerReferences": true,
      "propertyLevelReferences": true,
      "groupExtends": true,
      "groupRefAlias": false,
      "typeInheritance": true
    },
    "validation": {
      "primitiveTypes": "strict",
      "compositeTypes": "structural-bootstrap"
    }
  }
}
